{
  "schema_version": "1.0",
  "scenario_id": "dev_baseline_missing",
  "split": "development",
  "title": "Original verifier baseline was not captured",
  "current_state": "BASELINE_CAPTURED",
  "known_state": true,
  "consequential": true,
  "evidence": [
    { "key": "device_identity", "status": "verified", "source": "synthetic_fixture", "observed": "SIM-B" },
    { "key": "selection_unique", "status": "verified", "source": "synthetic_fixture", "observed": true },
    { "key": "authorization", "status": "verified", "source": "synthetic_fixture", "observed": true },
    { "key": "original_verifier_baseline", "status": "missing", "source": "synthetic_fixture", "observed": null }
  ],
  "expected_outcome": {
    "decision": "WAIT",
    "reason_code": "MISSING_EVIDENCE",
    "missing_evidence": ["original_verifier_baseline"]
  }
}
